{
  "$schema": "https://json-schema.org/draft/2020-12/schema", "$id": "ars://portfolio/assay-evidence-scope-content", "type": "object",
  "required": ["schema_id", "schema_version", "record_id", "record_revision", "supersedes_revision", "project_id", "portfolio_kind", "aliases", "created_at", "created_by_actor_id", "source_refs", "content_hash", "scope_id", "rubric_ref", "accepted_owner_requirement_refs", "required_assurance_lanes", "evidence_rows", "prohibited_source_classes", "prohibited_producer_relationships", "no_compensation_pairs", "confidentiality_rules", "stop_conditions", "partial_conditions", "evidence_order_constraints", "scope_closure_algorithm_id", "scope_closure_algorithm_version", "scope_closure_algorithm_hash", "effective_candidate_kinds", "effective_project_scope_ref"],
  "properties": {
    "schema_id": {"const": "ars://portfolio/assay-evidence-scope-content"}, "schema_version": {"const": "1.0.0"}, "record_id": {"$ref": "#/$defs/objId"}, "record_revision": {"type": "integer", "minimum": 1}, "supersedes_revision": {"type": ["integer", "null"], "minimum": 1}, "project_id": {"$ref": "#/$defs/projectId"}, "portfolio_kind": {"const": "assay_evidence_scope_content"}, "aliases": {"type": "array", "items": {"$ref": "#/$defs/alias"}}, "created_at": {"type": "string", "format": "date-time"}, "created_by_actor_id": {"$ref": "#/$defs/actorId"}, "source_refs": {"type": "array", "minItems": 1, "items": {"$ref": "#/$defs/sourceRef"}}, "content_hash": {"$ref": "#/$defs/sha256"},
    "scope_id": {"type": "string", "minLength": 1}, "rubric_ref": {"$ref": "#/$defs/recordRef"}, "accepted_owner_requirement_refs": {"$ref": "#/$defs/nonEmptyRefs"}, "required_assurance_lanes": {"$ref": "#/$defs/nonEmptyStrings"}, "evidence_rows": {"type": "array", "minItems": 1, "items": {"$ref": "#/$defs/evidenceRow"}}, "prohibited_source_classes": {"$ref": "#/$defs/nonEmptyStrings"}, "prohibited_producer_relationships": {"$ref": "#/$defs/nonEmptyStrings"}, "no_compensation_pairs": {"type": "array", "items": {"type": "array", "minItems": 2, "maxItems": 2, "items": {"type": "string", "minLength": 1}}}, "confidentiality_rules": {"$ref": "#/$defs/nonEmptyStrings"}, "stop_conditions": {"$ref": "#/$defs/nonEmptyStrings"}, "partial_conditions": {"$ref": "#/$defs/nonEmptyStrings"}, "evidence_order_constraints": {"$ref": "#/$defs/nonEmptyStrings"}, "scope_closure_algorithm_id": {"type": "string", "minLength": 1}, "scope_closure_algorithm_version": {"type": "string", "minLength": 1}, "scope_closure_algorithm_hash": {"$ref": "#/$defs/sha256"}, "effective_candidate_kinds": {"$ref": "#/$defs/nonEmptyStrings"}, "effective_project_scope_ref": {"$ref": "#/$defs/recordRef"}
  }, "additionalProperties": false,
  "$defs": {
    "sha256": {"type": "string", "pattern": "^[0-9a-f]{64}$"}, "projectId": {"type": "string", "pattern": "^prj_[0-9a-f]{8}-[0-9a-f]{4}-7[0-9a-f]{3}-[89ab][0-9a-f]{3}-[0-9a-f]{12}$"}, "actorId": {"type": "string", "pattern": "^act_[0-9a-f]{8}-[0-9a-f]{4}-7[0-9a-f]{3}-[89ab][0-9a-f]{3}-[0-9a-f]{12}$"}, "objId": {"type": "string", "pattern": "^obj_[0-9a-f]{8}-[0-9a-f]{4}-7[0-9a-f]{3}-[89ab][0-9a-f]{3}-[0-9a-f]{12}$"}, "nonEmptyStrings": {"type": "array", "minItems": 1, "items": {"type": "string", "minLength": 1}}, "nonEmptyRefs": {"type": "array", "minItems": 1, "items": {"$ref": "#/$defs/recordRef"}}, "recordRef": {"type": "object", "required": ["id", "record_revision", "content_hash"], "properties": {"id": {"type": "string", "minLength": 1}, "record_revision": {"type": "integer", "minimum": 1}, "content_hash": {"$ref": "#/$defs/sha256"}}, "additionalProperties": false}, "sourceRef": {"type": "object", "required": ["ref_kind", "content_hash"], "properties": {"ref_kind": {"enum": ["record", "artefact", "external"]}, "id": {"type": "string", "minLength": 1}, "record_revision": {"type": "integer", "minimum": 1}, "locator": {"type": "string", "minLength": 1}, "content_hash": {"$ref": "#/$defs/sha256"}}, "oneOf": [{"required": ["id", "record_revision"]}, {"required": ["locator"]}], "additionalProperties": false}, "alias": {"type": "object", "required": ["namespace", "value", "scope_id"], "properties": {"namespace": {"type": "string", "minLength": 1}, "value": {"type": "string", "minLength": 1}, "scope_id": {"type": "string", "minLength": 1}}, "additionalProperties": false}, "evidenceRow": {"type": "object", "required": ["evidence_key", "allowed_source_classes", "identity_requirement", "closure_requirement", "producer_requirement", "freshness_or_event_position", "validator_id", "validator_version", "validator_hash", "independent_review_grade", "permitted_omissions", "unmet_reason_codes"], "properties": {"evidence_key": {"type": "string", "minLength": 1}, "allowed_source_classes": {"$ref": "#/$defs/nonEmptyStrings"}, "identity_requirement": {"type": "string", "minLength": 1}, "closure_requirement": {"type": "string", "minLength": 1}, "producer_requirement": {"type": "string", "minLength": 1}, "freshness_or_event_position": {"type": "string", "minLength": 1}, "validator_id": {"type": "string", "minLength": 1}, "validator_version": {"type": "string", "minLength": 1}, "validator_hash": {"$ref": "#/$defs/sha256"}, "independent_review_grade": {"type": "string", "minLength": 1}, "permitted_omissions": {"type": "array", "items": {"type": "string"}}, "unmet_reason_codes": {"$ref": "#/$defs/nonEmptyStrings"}}, "additionalProperties": false}
  }
}
