{"accepted_owner_requirement_refs":[{"content_hash":"7e36b39a3a0aa0a01e262e9f8a8c0d8a35f111c76efa0054f2c326ee15860b80","id":"W11:OR-102","record_revision":1}],"aliases":[],"confidentiality_rules":["no provider credentials","no OAuth access","no survey microdata"],"content_hash":"ceb959dd0f8e9952fe2986ad7df7630b65cd9eee6ecf260dffc8526f31c60a18","created_at":"2026-08-17T20:00:00Z","created_by_actor_id":"act_9292d02f-7c6d-70ec-b188-6f1ef0ce36ee","effective_candidate_kinds":["method","application","robustness","negative_result"],"effective_project_scope_ref":{"content_hash":"fad7c5a9c9fd3cdec85125b20f006b7989c050d3050ec7fe7e7eb531744692d4","id":"prj_01978abc-1000-7000-8000-000000001000","record_revision":1},"evidence_order_constraints":["topology_earns_its_keep is evaluated first","data_feasibility and novelty_publishability are evaluated only after topology gate evidence"],"evidence_rows":[{"allowed_source_classes":["direct primary paper","immutable reference-code commit","operator evidence bundle"],"closure_requirement":"answer or explicitly block the topology object, discrepancy, planted noisy-circle, sphere-control, Euclidean-baseline, and disconnected-graph questions","evidence_key":"topology_earns_its_keep","freshness_or_event_position":"after accepted Assay-bar and bound to the exact issued SPEC-01 brief subject","identity_requirement":"exact paper and reference-code commit identity, licence, environment, formulas, symmetrisation, eigenvalue handling, and heuristic guard","independent_review_grade":"independent outcome review required","permitted_omissions":[],"producer_requirement":"sealed accepted prospective producer relation revalidated at score recording","unmet_reason_codes":["topology_not_earned","primary_paper_code_discrepancy","disconnected_graph_blocked","topology_evidence_blocked"],"validator_hash":"5cda241a5a85595286227f6bfb98a1f021a692b2341fa8d564ef56cca218c3e8","validator_id":"spec-01-topology-evidence-v1","validator_version":"1.0.0"},{"allowed_source_classes":["operator design evidence","registered representation specification","registered resource envelope"],"closure_requirement":"answer or explicitly block every data-feasibility question without survey microdata or numerical outcome inspection","evidence_key":"data_feasibility","freshness_or_event_position":"after accepted Assay-bar and bound to the exact issued SPEC-01 brief subject","identity_requirement":"exact future estimand, feature block, fit population, freeze rule, missingness, weighting, attrition, comparator, and resource envelope","independent_review_grade":"independent outcome review required","permitted_omissions":[],"producer_requirement":"sealed accepted prospective producer relation revalidated at score recording","unmet_reason_codes":["data_feasibility_zero","future_estimand_unidentified","representation_freeze_missing","resource_envelope_exceeded","data_evidence_blocked"],"validator_hash":"077270c066c409fb22f90d9d3d93bc67758c900d7db4f2739d52c4b8f9701021","validator_id":"spec-01-data-feasibility-evidence-v1","validator_version":"1.0.0"},{"allowed_source_classes":["direct primary source","closest-alternative analysis","operator evidence bundle"],"closure_requirement":"answer or explicitly block whether the contribution is non-redundant and publishable","evidence_key":"novelty_publishability","freshness_or_event_position":"after accepted Assay-bar and bound to the exact issued SPEC-01 brief subject","identity_requirement":"exact contribution class, primary claim, immutable source identities, and closest alternative","independent_review_grade":"independent outcome review required","permitted_omissions":[],"producer_requirement":"sealed accepted prospective producer relation revalidated at score recording","unmet_reason_codes":["novelty_publishability_zero","redundancy_verified","primary_claim_missing","novelty_evidence_blocked"],"validator_hash":"6d95db57c2ccef3243491eba52b6c296aa6e5533080d5ae54eed549e876e7b25","validator_id":"spec-01-novelty-publishability-evidence-v1","validator_version":"1.0.0"}],"no_compensation_pairs":[["topology_earns_its_keep","data_feasibility"],["topology_earns_its_keep","novelty_publishability"],["data_feasibility","novelty_publishability"]],"partial_conditions":["required evidence is blocked or incomplete","Partial cannot be relabelled PROMOTE"],"portfolio_kind":"assay_evidence_scope_content","prohibited_producer_relationships":["self-review"],"prohibited_source_classes":["survey microdata","numerical experiment result","provider result"],"project_id":"prj_01978abc-1000-7000-8000-000000001000","record_id":"obj_019fed25-b33e-7740-b280-000000000102","record_revision":2,"required_assurance_lanes":["Output","Provenance","independent_outcome_review"],"rubric_ref":{"content_hash":"2dd008b78c7bcb5a38cdc69f47242443450348afdfaf93a0ee6a7729c72e00c5","id":"obj_019fed25-b33e-7740-b280-000000000101","record_revision":2},"schema_id":"ars://portfolio/assay-evidence-scope-content","schema_version":"1.0.0","scope_closure_algorithm_hash":"1152350eddf32813a8968940cf5cf9a408dfa09f28c48e711e9fd1a8a481bcc2","scope_closure_algorithm_id":"spec-01-exact-evidence-scope-v1","scope_closure_algorithm_version":"1.0.0","scope_id":"spec-01.assay-scope.v1","source_refs":[{"content_hash":"d3b1eac020b5c94707461c0a475cc911e36ab78e2bc1243c0b28747748106972","id":"SPEC-01","record_revision":1,"ref_kind":"artefact"},{"content_hash":"fad7c5a9c9fd3cdec85125b20f006b7989c050d3050ec7fe7e7eb531744692d4","id":"SPEC-GATE6-RUN-V1","record_revision":1,"ref_kind":"artefact"},{"content_hash":"7e36b39a3a0aa0a01e262e9f8a8c0d8a35f111c76efa0054f2c326ee15860b80","locator":"accepted-w11-catalogue","ref_kind":"external"}],"stop_conditions":["provider API use","provider process or command-line launch by ARS","credential or OAuth access","survey-data access","numerical outcome inspection","code implementation","unregistered object writes","fabricated identity or grant","self-review","automatic promotion","reviewed PROMOTE reaches an explicit owner decision and stops","SPEC-02 requires a later separate explicit live-run approval"],"supersedes_revision":1}
